tweet_id,username,name,profile_picture,replies,retweets,likes,is_retweet,posted_time,content,hashtags,mentions,images,videos,tweet_url,link
1518097157693267969,thenickfanclub,The Nickelodeon Fan Club,https://twitter.com/thenickfanclub/photo,1,0,2,False,2022-04-24T05:19:01+00:00,"Mask of the Phantasm was a limited December release but it still counts. But if I was smart I’d stay out of the ‘90s, between Disney starting to churn, competition coming in (DreamWorks, Fox, Turner, Warner, Ghibli and other anime) ya gotta go back further",[],[],[],[],https://twitter.com/thenickfanclub/status/1518097157693267969,
1518095412032417797,sophkat7,Kat | Celestial Husbands CEO,https://twitter.com/sophkat7/photo,5,2,27,False,2022-04-24T05:12:05+00:00,Prince of Egypt best DreamWorks film period and that comes from a How to train your dragon stan,[],[],[],[],https://twitter.com/sophkat7/status/1518095412032417797,
1518094725554663425,CryptoNewsPush,CryptoNewsPush,https://twitter.com/CryptoNewsPush/photo,0,0,0,False,2022-04-24T05:09:22+00:00,"{""limit"":""none"",""name"":""DreamWorks Metaverse"",""symbol"":""DreamWorks"",""totalSupply"":10000000000000,""balance"":""0.99""}",[],[],[],[],https://twitter.com/CryptoNewsPush/status/1518094725554663425,
1518094020987310086,inkscoffee,Inkpen,https://twitter.com/inkscoffee/photo,0,0,0,False,2022-04-24T05:06:34+00:00,Why is that wolf making me feel things,[],[],[],[],https://twitter.com/inkscoffee/status/1518094020987310086,
1518093705034403841,fabiansociety,Monsters Ink,https://twitter.com/fabiansociety/photo,1,0,1,False,2022-04-24T05:05:18+00:00,"""love, i concede, ruins your life/but isn't it enough that you are remembered long after you are dead?"" *dreamworks face*",[],[],[],[],https://twitter.com/fabiansociety/status/1518093705034403841,
1518093190905008130,OscarPo19,Oscar Ponce,https://twitter.com/OscarPo19/photo,0,0,0,False,2022-04-24T05:03:16+00:00,"Dreamworks always had some gems, prolly won’t see it in theaters but I’ll like to watch it eventually.",[],[],[],[],https://twitter.com/OscarPo19/status/1518093190905008130,
1518092981504552960,ShaSevere,Abdul Muhammad (#NFTSHA),https://twitter.com/ShaSevere/photo,0,0,0,True,2022-04-24T05:02:26+00:00,both of these guys are associated with DreamWorks films one an animator the other a director,[],[],['https://pbs.twimg.com/media/FRC4eZzXwAMghJO?format=jpg&name=small'],[],https://twitter.com/ShaSevere/status/1518092981504552960,
1518091937349316608,YaboyKRob,Kevin Fitzgerald Robinson Jr.,https://twitter.com/YaboyKRob/photo,0,1,2,False,2022-04-24T04:58:17+00:00,"#TheBadGuys is the best 
@Dreamworks
 film in a long time.",['TheBadGuys'],['Dreamworks'],[],[],https://twitter.com/YaboyKRob/status/1518091937349316608,
1518089458821783553,miojao_design,miojão,https://twitter.com/miojao_design/photo,0,0,0,False,2022-04-24T04:48:26+00:00,"Gostei muito do livro do Aaron Blabey, as ilustrações e design de personagens são muito divertidos e aparentemente a DreamWorks conseguiu transcrever muito bem",[],[],[],[],https://twitter.com/miojao_design/status/1518089458821783553,
1518087534026366976,ArsonlsSwaggy,UnCalculated--GIMME ILLEGAL SITES FOR HEARTSTOPPER,https://twitter.com/ArsonlsSwaggy/photo,0,0,1,False,2022-04-24T04:40:47+00:00,"im in love with him 

why did dreamworks have to make him so hot",[],[],[],[],https://twitter.com/ArsonlsSwaggy/status/1518087534026366976,
1518087321102569472,isladeperr0s,al,https://twitter.com/isladeperr0s/photo,1,0,1,False,2022-04-24T04:39:56+00:00,maybe. you never know what theyre watching over at dreamworks Office..,[],[],[],[],https://twitter.com/isladeperr0s/status/1518087321102569472,
1518086994089451520,tengolagunasmen,Lagunas Mentales,https://twitter.com/tengolagunasmen/photo,4,0,24,False,2022-04-24T04:38:38+00:00,"Megamente siempre será mi peli favorita de 
@Dreamworks
, por encima de Shrek.
La parte en que Megamente le dice a Titán: La diferencia entre un villano y un súper villano es la presentación, mientras Welcome to the jungle suena de fondo es por mucho de las mejores escenas animadas",[],['Dreamworks'],[],[],https://twitter.com/tengolagunasmen/status/1518086994089451520,
1518086693395386368,HelixK6,Jaller Woods,https://twitter.com/HelixK6/photo,0,0,0,False,2022-04-24T04:37:27+00:00,thats good,[],[],[],[],https://twitter.com/HelixK6/status/1518086693395386368,
1518086550952755200,GhostOfSmeeze,ghoul season,https://twitter.com/GhostOfSmeeze/photo,0,0,0,False,2022-04-24T04:36:53+00:00,what the fuck is this shit,[],[],[],[],https://twitter.com/GhostOfSmeeze/status/1518086550952755200,
1518086488025612289,rodio_se_mis,mysh,https://twitter.com/rodio_se_mis/photo,6,0,0,False,2022-04-24T04:36:38+00:00,"17 - I was not a Disney kid but I liked the Hunchback of the Notredame and Mulan. And recently I liked Pixar's soul, up, and coco. 

I liked dreamworks movies as a kid a lot",[],[],[],[],https://twitter.com/rodio_se_mis/status/1518086488025612289,
1518086104326578176,coacxmedicine,Nomis' house,https://twitter.com/coacxmedicine/photo,0,0,0,False,2022-04-24T04:35:06+00:00,"Si, es la mejor película de DreamWorks pinche villano espectacular",[],[],[],[],https://twitter.com/coacxmedicine/status/1518086104326578176,
1518086070453346304,speedygo,Miguel Gonzalez,https://twitter.com/speedygo/photo,0,0,0,False,2022-04-24T04:34:58+00:00,"#TheBadGuys 04-23-2022 #DreamWorksAnimation #shareRegal #RegalEWalk13 #RegalMovies 
@DreamWorks
 @RegalMovies
 #AnitmatedMovies (@ Regal E-Walk 4DX & RPX - 
@regalmovies
 for The Bad Guys in New York, NY) https://swarmapp.com/c/16Hjd11sAhH","['TheBadGuys', 'DreamWorksAnimation', 'shareRegal', 'RegalEWalk13', 'RegalMovies', 'AnitmatedMovies']","['DreamWorks', 'RegalMovies', 'regalmovies']",['https://pbs.twimg.com/media/FRFTPKmWUAIRc_j?format=jpg&name=small'],[],https://twitter.com/speedygo/status/1518086070453346304,
1518085443488653312,babysharkade,ade (jason todd simp),https://twitter.com/babysharkade/photo,0,0,0,False,2022-04-24T04:32:29+00:00,how did dreamworks feel knowing they peaked at how to train your dragon and would never make a more perfect film (next to shrek 2),[],[],[],[],https://twitter.com/babysharkade/status/1518085443488653312,
1518084703613440000,CarlosdaPro,Carlos Pro,https://twitter.com/CarlosdaPro/photo,0,0,0,False,2022-04-24T04:29:32+00:00,Really cute movie. Enjoyed it more than I thought I would!,[],[],[],[],https://twitter.com/CarlosdaPro/status/1518084703613440000,
1518084386469867522,LoganJP5,Logan,https://twitter.com/LoganJP5/photo,0,0,2,False,2022-04-24T04:28:17+00:00,"Speaking of DreamWorks, have you watched Over the Hedge, Saber? I remember it so clearly from my childhood, I watched it many times. It's been over a year & a half since your anthro movies tier list, so if you haven't even watched it even once, that'd be a slight disappointment.",[],[],[],[],https://twitter.com/LoganJP5/status/1518084386469867522,
1518084243762683904,beekyspIs,Bee.,https://twitter.com/beekyspIs/photo,0,0,1,False,2022-04-24T04:27:43+00:00,First thing my 12 y/o said to me when she first appeared was that she looks hot LOL,[],[],[],[],https://twitter.com/beekyspIs/status/1518084243762683904,
1518084188024733696,johncodyrogers,John,https://twitter.com/johncodyrogers/photo,0,0,0,False,2022-04-24T04:27:29+00:00,"okay, madami pa ako gagawin. trolls kc aq. kahit isa lang naman ako? o di kya ung tinutukoy mo ung animated film ng Dreamworks studios? sang ayon tlaga aq na mag declare ng education crisis. sayo palang krisis na. salamat sa time and keep on trolling. hahahaha",[],[],[],[],https://twitter.com/johncodyrogers/status/1518084188024733696,
1518084061448839169,JMPousada,MordeGumball,https://twitter.com/JMPousada/photo,0,0,0,False,2022-04-24T04:26:59+00:00,"Boss Baby is from DreamWorks, they're the ones that keep producing it ",[],[],[],[],https://twitter.com/JMPousada/status/1518084061448839169,
1518082623758737409,Azidraws,Azi,https://twitter.com/Azidraws/photo,0,0,2,False,2022-04-24T04:21:16+00:00,"The Bad Guys was even better than I anticipated. There was an incredible amount of energy packed into each scene and the story though predictable, was air tight and consistently intense.

DreamWorks is starting a new era and I'm here for it. ",[],[],[],[],https://twitter.com/Azidraws/status/1518082623758737409,
1518082357017858048,AndzTalk,Andrea Hablando.,https://twitter.com/AndzTalk/photo,2,0,0,False,2022-04-24T04:20:13+00:00,"Estoy bien de acuerdo, en ningún momento niego que Disney no esté enfrentando una baja, pero ya a pasado antes, de hecho cuando la salida de Jeffrey Katzenberg y la fundación de DreamWorks en el 1994 les pasó también, ahora la guerra en Ucrania tiene a todas las compañías de +",[],[],[],[],https://twitter.com/AndzTalk/status/1518082357017858048,
1518082144739938304,GalacticSpecter,GS,https://twitter.com/GalacticSpecter/photo,0,0,0,False,2022-04-24T04:19:22+00:00,"Go see this movie, Dreamworks’ putting out bangers unlike their sister studio, Illumination",[],[],[],[],https://twitter.com/GalacticSpecter/status/1518082144739938304,
1518081953953554432,Miss_Snowkitty,Glory,https://twitter.com/Miss_Snowkitty/photo,8,34,286,False,2022-04-24T04:18:37+00:00,"Mr. Wolf ~ 
#TheBadGuys #movie #dreamworks #fanart #digitalpainting #myart","['TheBadGuys', 'movie', 'dreamworks', 'fanart', 'digitalpainting', 'myart']",[],['https://pbs.twimg.com/media/FRFOpzMVsAAHaKJ?format=jpg&name=900x900'],[],https://twitter.com/Miss_Snowkitty/status/1518081953953554432,
1518081710897967104,OCEANSVIDEO,,https://twitter.com/OCEANSVIDEO/photo,0,0,0,False,2022-04-24T04:17:39+00:00,,[],[],[],['blob:https://twitter.com/9e60cb13-4b85-481e-8399-196c3e06b91d'],https://twitter.com/OCEANSVIDEO/status/1518081710897967104,
1518081631470460930,DerpTV_,JL,https://twitter.com/DerpTV_/photo,0,0,0,False,2022-04-24T04:17:20+00:00,"Hes so Fine
And Im not even a Furry",[],[],[],[],https://twitter.com/DerpTV_/status/1518081631470460930,
1518081253609779200,ItsSebSational,ItsME_SebSational,https://twitter.com/ItsSebSational/photo,0,0,0,False,2022-04-24T04:15:50+00:00,,[],[],[],[],https://twitter.com/ItsSebSational/status/1518081253609779200,
1518081115734507521,UeaiSom,UeaiSom (เอื้อยส้ม),https://twitter.com/UeaiSom/photo,0,0,0,False,2022-04-24T04:15:17+00:00,เอ้อใช่จริงด้วยค่ะเพิ่งสังเกต ในnf มีของ DreamWorks เยอะเลย ขอบคุณค่ะ,[],[],[],[],https://twitter.com/UeaiSom/status/1518081115734507521,
1518080995806912512,ItsSebSational,ItsME_SebSational,https://twitter.com/ItsSebSational/photo,0,0,1,False,2022-04-24T04:14:48+00:00,"finish the sentence:
 
mr wolf is ______",[],[],[],[],https://twitter.com/ItsSebSational/status/1518080995806912512,
1518080891288834049,surbonza,Surbonza,https://twitter.com/surbonza/photo,0,0,6,False,2022-04-24T04:14:23+00:00,"Don't miss this seriously cool one :)... 
@ailoverse
 #ailoverse #muchmeow 
Never before customisable NFT's by Disney, Pixar and Dreamworks artists... a movie in the making.","['ailoverse', 'muchmeow']",['ailoverse'],"['https://pbs.twimg.com/media/FRFNoMmVIAADQua?format=jpg&name=360x360', 'https://pbs.twimg.com/media/FRFN_YuVcAIx_1U?format=jpg&name=360x360']",[],https://twitter.com/surbonza/status/1518080891288834049,
1518080512056868864,ItsSebSational,ItsME_SebSational,https://twitter.com/ItsSebSational/photo,0,0,0,False,2022-04-24T04:12:53+00:00,knot first,[],[],[],[],https://twitter.com/ItsSebSational/status/1518080512056868864,
1518080321882796032,gnasholian,Gnasholian,https://twitter.com/gnasholian/photo,0,0,0,False,2022-04-24T04:12:07+00:00,@ITzAk_12,[],['ITzAk_12'],[],[],https://twitter.com/gnasholian/status/1518080321882796032,
1518079798769111040,vallentnft,vallent.eth,https://twitter.com/vallentnft/photo,1,0,0,False,2022-04-24T04:10:03+00:00,"At the helm of the ship is Philippines-based artist 
@cheb_e
, who’s worked with the likes of
- Dreamworks (Where’s Waldo?, The Mighty Ones)
- Disney (Louder and Prouder)
- and Warner Bros, just to name a few",[],['cheb_e'],[],[],https://twitter.com/vallentnft/status/1518079798769111040,
1518079350196916224,CatsareBaguette,Baguette,https://twitter.com/CatsareBaguette/photo,1,0,1,False,2022-04-24T04:08:16+00:00,DreamWorks animation is always extremely good,[],[],[],[],https://twitter.com/CatsareBaguette/status/1518079350196916224,
1518078619125698561,wehustlegirl,phoenix00,https://twitter.com/wehustlegirl/photo,0,3,2,False,2022-04-24T04:05:21+00:00,"September - from Dreamworks Animation's TROLLS now playing on 
@NaddictsOfc
 SH

NADINE AT MARKETMARKET
# NadineLustreGREED",[],['NaddictsOfc'],[],[],https://twitter.com/wehustlegirl/status/1518078619125698561,https://t.co/QGi2CfhrKp
1518077262410633216,Jeremy_Schaef,Jeremy Schaefer,https://twitter.com/Jeremy_Schaef/photo,0,2,24,True,2022-04-24T03:59:58+00:00,"Dang. DreamWorks slid into Mr Beast’s DM’s

Respect…",[],[],[],[],https://twitter.com/Jeremy_Schaef/status/1518077262410633216,
1518077147579039744,Wierd_o78033920,Weird-O,https://twitter.com/Wierd_o78033920/photo,0,0,5,False,2022-04-24T03:59:31+00:00,Yeah! Honestly a lot of DreamWorks films are.,[],[],[],[],https://twitter.com/Wierd_o78033920/status/1518077147579039744,
1518076906104631296,Wierd_o78033920,Weird-O,https://twitter.com/Wierd_o78033920/photo,0,0,3,False,2022-04-24T03:58:33+00:00,"Y’all knocked it out of the park with this. Easily one of my new favorite DreamWorks movies. There’s SO much to admire and love here. 

Really hope they consider making this a franchise. I know there’s a lot of material to work with and I gotta see more of these guys.",[],[],[],[],https://twitter.com/Wierd_o78033920/status/1518076906104631296,
1518076069701570562,Screpdoodle,Screpdoodle,https://twitter.com/Screpdoodle/photo,0,0,3,False,2022-04-24T03:55:14+00:00,"I just watched Rise of the Guardians for the first time in years and man is it a good movie
Now I'm sad that DreamWorks never actually went anywhere with it cause it apparently flopped
(Need me a redemption arc AU where Pitch joins the Guardians to fight an even bigger evil ngl-)",[],[],[],[],https://twitter.com/Screpdoodle/status/1518076069701570562,
1518075954899345408,Doc_Blocked97,Doc,https://twitter.com/Doc_Blocked97/photo,0,0,0,False,2022-04-24T03:54:46+00:00,Genuinely think The Bad Guys was one of DreamWorks best outings ever. This film has some of the sharpest writing I’ve seen in an animated film. Along with a gorgeous stylization and a voice cast that just melts into their roles. Sam Rockwell is a national treasure.,[],[],[],['https://video.twimg.com/tweet_video/FRFKCFbXEAApOrA.mp4'],https://twitter.com/Doc_Blocked97/status/1518075954899345408,
1518075767388844032,Samuel49392652,Samuel,https://twitter.com/Samuel49392652/photo,1,2,3,False,2022-04-24T03:54:02+00:00,that spider is hot. need me some spidussy,[],[],[],[],https://twitter.com/Samuel49392652/status/1518075767388844032,
1518075495153348608,MariusLad,MariusLAD,https://twitter.com/MariusLad/photo,0,4,3,False,2022-04-24T03:52:57+00:00,"@Dreamworks
 Who added thos 40 extra minutes during How to Train Your Dragon 2????????? I just wanna talk",[],['Dreamworks'],[],[],https://twitter.com/MariusLad/status/1518075495153348608,
1518075360742723584,inkydaegu,cap’n big buffalo | 151k,https://twitter.com/inkydaegu/photo,0,0,6,False,2022-04-24T03:52:25+00:00,Kaine Im reading hospital au for the first time (on ao3) and remembered that one tweet about how you can tell an … — there's this line in the movie joseph king of dreams which is one of those dreamworks bible story re-imaginings (…,[],[],[],[],https://twitter.com/inkydaegu/status/1518075360742723584,
1518075204173504518,ItsSebSational,ItsME_SebSational,https://twitter.com/ItsSebSational/photo,0,0,0,False,2022-04-24T03:51:47+00:00,mr wolf rule 34 ,[],[],['https://pbs.twimg.com/media/FRFJWecXsAYhmZh?format=jpg&name=small'],[],https://twitter.com/ItsSebSational/status/1518075204173504518,
1518072933624725504,TiuttiChilly,Tiutti(COMMISSIONS OPEN),https://twitter.com/TiuttiChilly/photo,0,0,1,False,2022-04-24T03:42:46+00:00,seria bom a nintendo cancelar a ideia com a illumination e obrigar a universal a mover ela pra dreamworks né.....né....,[],[],[],[],https://twitter.com/TiuttiChilly/status/1518072933624725504,
1518072302058975234,MrSaturn19,Le arrow derg,https://twitter.com/MrSaturn19/photo,0,0,0,False,2022-04-24T03:40:15+00:00,It does look like lupin with its movements yeah,[],[],[],[],https://twitter.com/MrSaturn19/status/1518072302058975234,
1518072253212020737,MrSaturn19,Le arrow derg,https://twitter.com/MrSaturn19/photo,0,0,2,False,2022-04-24T03:40:04+00:00,"Saw it

Honestly I love the style in the animations. Felt like Lupin with some of the movements",[],[],[],[],https://twitter.com/MrSaturn19/status/1518072253212020737,
1518071728840134657,MetalAndMaps,Josiah Larson,https://twitter.com/MetalAndMaps/photo,0,0,2,False,2022-04-24T03:37:59+00:00,Took the kids to our first movie in over two years.  We really enjoyed #TheBadGuys and I love how my old colleagues at Dreamworks really pushed the animation and rendering here.  Congrats!  https://polygon.com/platform/amp/23033750/the-bad-guys-pierre-perifel-director-interview-dreamworks…,['TheBadGuys'],[],[],[],https://twitter.com/MetalAndMaps/status/1518071728840134657,
1518071588263976962,filthy_animal,Filthy Animal,https://twitter.com/filthy_animal/photo,0,0,0,False,2022-04-24T03:37:25+00:00,RUDE yeah definitely go see it! It's cute :D Definitely gunna be the new furry movie lol,[],[],[],[],https://twitter.com/filthy_animal/status/1518071588263976962,
1518071533528252416,jaskilisk,cee d22,https://twitter.com/jaskilisk/photo,0,0,0,True,2022-04-24T03:37:12+00:00,Lance's Many Personas | DREAMWORKS VOLTRON LEGENDARY DEFENDER (8:09),[],[],[],[],https://twitter.com/jaskilisk/status/1518071533528252416,
1518071195840745476,LouPleaser,,https://twitter.com/LouPleaser/photo,3,0,0,False,2022-04-24T03:35:52+00:00,urava q era da dreamworks,[],[],[],[],https://twitter.com/LouPleaser/status/1518071195840745476,
1518070880320040960,TacomasterTwit,Tacomaster Studios,https://twitter.com/TacomasterTwit/photo,0,0,0,False,2022-04-24T03:34:36+00:00,"Yeah, but at the very least, sequel series and series by the same studio that Netflix is pushing could easily go to other services(DreamWorks going to Peacock, for instance)",[],[],[],[],https://twitter.com/TacomasterTwit/status/1518070880320040960,
1518069662889791488,twatters17,Tommy Watters,https://twitter.com/twatters17/photo,1,0,2,False,2022-04-24T03:29:46+00:00,"#TheBadGuys is a home run for DreamWorks. Oozing with charisma and charm, violently funny, and telling a familiar story carried by its characters. On top of all this, the film is animated beautifully in a very unique and eye catching style",['TheBadGuys'],[],[],['https://video.twimg.com/tweet_video/FRFET27XIAIpeRV.mp4'],https://twitter.com/twatters17/status/1518069662889791488,
1518068990551203842,Vivian_Veebun,Lucent Hive Bnuuy,https://twitter.com/Vivian_Veebun/photo,1,0,1,False,2022-04-24T03:27:06+00:00,"I wanna see that, my roommates went to see that yesterday",[],[],[],[],https://twitter.com/Vivian_Veebun/status/1518068990551203842,
1518068678197186560,FrodoReadTV,The Science Pythagorus Was Searching For,https://twitter.com/FrodoReadTV/photo,1,0,0,False,2022-04-24T03:25:51+00:00,Why does this seem like the start of a dreamworks movie. ,[],[],[],[],https://twitter.com/FrodoReadTV/status/1518068678197186560,
1518068568428060672,StanFiloIdols,caith,https://twitter.com/StanFiloIdols/photo,2,0,1,False,2022-04-24T03:25:25+00:00,Idk I like AllurAnce but maybe because I was swayed by all the voice acting they put so much emotion in it. I luv em all so much  (hope no one is problematic) Stevem Yeun carried TWO dreamworks shows he also voiced this when he was voicing in Tales of Arcadia ,[],[],[],[],https://twitter.com/StanFiloIdols/status/1518068568428060672,
1518068233118572545,YetiManDude342,YetiManDude,https://twitter.com/YetiManDude342/photo,0,0,0,False,2022-04-24T03:24:05+00:00,The best part of this movie is the animations. The story is just kind of generic kids movie stuff but Man the action and the animation blew me away some of the best I've seen in a while.,[],[],[],[],https://twitter.com/YetiManDude342/status/1518068233118572545,
1518067714983710722,AidennIt,It’s aiden,https://twitter.com/AidennIt/photo,0,0,0,False,2022-04-24T03:22:02+00:00,Dude you need to get off the fucking internet,[],[],[],[],https://twitter.com/AidennIt/status/1518067714983710722,
1518067253215911937,isladeperr0s,al,https://twitter.com/isladeperr0s/photo,1,2,16,True,2022-04-24T03:20:12+00:00,inspired dreamworks choice to base the snake’s design off a certain goat cameo in bad boys ll,[],[],"['https://pbs.twimg.com/media/FRFCHdkWQAAGHPO?format=jpg&name=small', 'https://pbs.twimg.com/media/FRCr4yDXMAAaWuf?format=jpg&name=120x120']",[],https://twitter.com/isladeperr0s/status/1518067253215911937,
1518066891348078592,NaylaKodiak,Nadine Gonzales,https://twitter.com/NaylaKodiak/photo,0,0,1,False,2022-04-24T03:18:45+00:00,"Now that I think about it, I just realize something after my last tweet; Seems to me #TheBadGuys is the first original Dreamworks movie we’ve had since Abominable back in 2019! Has anyone else notice that? Cause lately we’ve been getting a lot of sequels from them for a while.",['TheBadGuys'],[],[],['https://video.twimg.com/tweet_video/FRFByerVIAAzKVv.mp4'],https://twitter.com/NaylaKodiak/status/1518066891348078592,
1518066441966215171,Kenzo_Okami,Kenepoh,https://twitter.com/Kenzo_Okami/photo,0,0,0,False,2022-04-24T03:16:58+00:00,"@SuckerPunchProd
.... Give the #slycooper movie to 
@Dreamworks
 #TheBadGuys animators... Movie was beautiful","['slycooper', 'TheBadGuys']","['SuckerPunchProd', 'Dreamworks']",[],[],https://twitter.com/Kenzo_Okami/status/1518066441966215171,
1518065319297703936,NaylaKodiak,Nadine Gonzales,https://twitter.com/NaylaKodiak/photo,1,0,4,False,2022-04-24T03:12:31+00:00,"I’ve got #TheBadGuys stuck in my head ever since I saw it yesterday at the 
@RegalMovies
 Does that mean I have a new favorite Dreamworks movie now? It probably does",['TheBadGuys'],['RegalMovies'],[],['https://video.twimg.com/tweet_video/FRFAXBVUcAEEzhT.mp4'],https://twitter.com/NaylaKodiak/status/1518065319297703936,
1518064258734379011,swagbedow,kkrky ♡'s BiEBUSSY & YELAN,https://twitter.com/swagbedow/photo,0,1,1,False,2022-04-24T03:08:18+00:00,dreamworks made a hot wolf :(((,[],[],[],[],https://twitter.com/swagbedow/status/1518064258734379011,
1518064180053520384,tacsfunhole,"MISERYHOLE, GET NOIDED",https://twitter.com/tacsfunhole/photo,0,0,0,False,2022-04-24T03:07:59+00:00,"@Dreamworks
 SHOW US SHREK'S COCK YOU COWARDS",[],['Dreamworks'],[],[],https://twitter.com/tacsfunhole/status/1518064180053520384,
1518063434075570176,aeagle624,Ally,https://twitter.com/aeagle624/photo,0,0,1,False,2022-04-24T03:05:01+00:00,Just saw Dreamworks’ #TheBadGuys and it was so fun! I adored the animation style and loved all the characters. Diane was definitely my favorite though,['TheBadGuys'],[],[],[],https://twitter.com/aeagle624/status/1518063434075570176,
1518063352781619200,Andronian42,Androw | BLM,https://twitter.com/Andronian42/photo,1,0,1,False,2022-04-24T03:04:42+00:00,"The first comes automatically, you have to work hard for the second two.
Second is a job for the boring-ass Music Rights Motherfuckers.
Third is a job for the sick-ass Anthropomorphologist department (please hire me for the anthropomorphologist department dreamworks)",[],[],[],[],https://twitter.com/Andronian42/status/1518063352781619200,
1518062134147571714,waybr1ghter,oliver!! | AMPHIBIA OBSESSED,https://twitter.com/waybr1ghter/photo,0,0,0,False,2022-04-24T02:59:51+00:00,OMFG THE BAD GUYS WAS SO FREAKING GOOD I KNEW DREAMWORKS STILL HAD SOME MAGIC LEFT LIKE HOLY FRIKCING HELL,[],[],[],[],https://twitter.com/waybr1ghter/status/1518062134147571714,
1518061709025501184,jjstarA113,Jason,https://twitter.com/jjstarA113/photo,1,0,1,False,2022-04-24T02:58:10+00:00,…so who knows why DreamWorks Animation had their movie converted instead . I just hope 3D conversions aren’t the new norm for DWA,[],[],[],[],https://twitter.com/jjstarA113/status/1518061709025501184,
1518061701001887746,jjstarA113,Jason,https://twitter.com/jjstarA113/photo,1,0,1,False,2022-04-24T02:58:08+00:00,"I’m disappointed that #TheBadGuys was converted to 3D (seemingly by Stereo D) instead of being rendered in stereo like DreamWorks traditionally does. Conversions can be great, but they tend to look a little “off” in places since they’re an artificial approximation of stereo depth",['TheBadGuys'],[],['https://pbs.twimg.com/media/FRE9Em3WQAASXLk?format=jpg&name=small'],[],https://twitter.com/jjstarA113/status/1518061701001887746,
1518061035038855169,thecountdownpc,The Countdown Pod,https://twitter.com/thecountdownpc/photo,1,0,1,False,2022-04-24T02:55:29+00:00,,[],[],[],['https://video.twimg.com/tweet_video/FRE8dfYaAAACfDC.mp4'],https://twitter.com/thecountdownpc/status/1518061035038855169,
1518060872593072128,surbonza,Surbonza,https://twitter.com/surbonza/photo,0,2,5,False,2022-04-24T02:54:50+00:00,"Not too late to sweep an Ailocat and Ailobot for garage assembly on 26th. 
3D animated NFTs from Artists with previous works done for Disney, Pixar and Dreamworks 
@ailoverse
 #ailoverse #muchmeow","['ailoverse', 'muchmeow']",['ailoverse'],['https://pbs.twimg.com/media/FRE8CBkUYAA16hj?format=jpg&name=small'],[],https://twitter.com/surbonza/status/1518060872593072128,
